{
  "schemaVersion": 1,
  "productVersion": "1.0.4",
  "databaseSchemaVersion": 53,
  "combinations": [
    {
      "backend": "1.0.4",
      "web": "1.0.4",
      "appVersionCodeRange": { "minimum": 101, "maximum": 104 },
      "databaseSchema": 53,
      "status": "SUPPORTED",
      "notes": "Approved for the additive nullable V53 abnormal-measure columns after explicit risk acceptance to skip the real migration rehearsal; Web 1.0.4 and APP versionCode 101-104 remain contract-compatible, and APP 104 is packaged separately by the user."
    },
    {
      "backend": "1.0.0",
      "web": "1.0.1",
      "appVersionCodeRange": { "minimum": 2, "maximum": 100 },
      "databaseSchema": 50,
      "status": "BLOCKED",
      "notes": "The previous mobile contract probes an endpoint removed by this release and must upgrade before connecting."
    }
  ],
  "unknownCombinationPolicy": "BLOCKED"
}
